<?xml version="1.0" encoding="UTF-8"?>
<tns:LabelDefinitions xmlns:tns="http://mcz.harvard.edu/LabelDefinitionSchema" xmlns:xsi="http://www.w3.org/2001/XMLSchema-instance" xsi:schemaLocation="http://mcz.harvard.edu/LabelDefinitionSchema ../../../../../../supporting/LabelDefinitionSchema.xsd ">
  <tns:LabelDefinition>
    <tns:Title>Full Sheet</tns:Title>
    <tns:Units>Inches</tns:Units>
    <tns:PaperHeight>11</tns:PaperHeight>
    <tns:PaperWidth>8.5</tns:PaperWidth>
    <tns:Margins>.5</tns:Margins>
    <tns:Columns>1</tns:Columns>
    <tns:LabelWidth>7.5</tns:LabelWidth>
    <tns:LabelHeight>10</tns:LabelHeight>
    <tns:TextOrentation>Horizontal</tns:TextOrentation>
  </tns:LabelDefinition>
  <tns:LabelDefinition>
    <tns:Title>Half Sheet</tns:Title>
    <tns:Units>Inches</tns:Units>
    <tns:PaperHeight>11</tns:PaperHeight>
    <tns:PaperWidth>8.5</tns:PaperWidth>
    <tns:Margins>.5</tns:Margins>
    <tns:Columns>2</tns:Columns>
    <tns:LabelWidth>3.25</tns:LabelWidth>
    <tns:LabelHeight>10</tns:LabelHeight>
    <tns:TextOrentation>Vertical</tns:TextOrentation>
  </tns:LabelDefinition>
  <tns:LabelDefinition>
    <tns:Title>2.5x4 on Paper</tns:Title>
    <tns:Units>Inches</tns:Units>
    <tns:PaperHeight>11</tns:PaperHeight>
    <tns:PaperWidth>8.5</tns:PaperWidth>
    <tns:Margins>.5</tns:Margins>
    <tns:Columns>2</tns:Columns>
    <tns:LabelWidth>3.25</tns:LabelWidth>
    <tns:LabelHeight>2.5</tns:LabelHeight>
    <tns:TextOrentation>Horizontal</tns:TextOrentation>
  </tns:LabelDefinition>
  <tns:LabelDefinition>
    <tns:Title>4x2.3"Label</tns:Title>
    <tns:Units>Inches</tns:Units>
    <tns:PaperHeight>2.3125</tns:PaperHeight>
    <tns:PaperWidth>4</tns:PaperWidth>
    <tns:Margins>.1</tns:Margins>
    <tns:Columns>1</tns:Columns>
    <tns:LabelWidth>3.8</tns:LabelWidth>
    <tns:LabelHeight>2.1125</tns:LabelHeight>
    <tns:TextOrentation>Horizontal</tns:TextOrentation>
  </tns:LabelDefinition>  
</tns:LabelDefinitions>
